{
  "$schema": "https://json-schema.org/draft/2020-12/schema",
  "$id": "todo-detail",
  "title": "TodoDetail",
  "description": "Todo詳細。フェイクデータ50件の観察から導いたスキーマ。",
  "type": "object",
  "required": ["todoId", "todoTitle", "isCompleted", "createdAt"],
  "properties": {
    "todoId": {
      "type": "string",
      "description": "ULID形式の識別子",
      "minLength": 26,
      "maxLength": 26
    },
    "todoTitle": {
      "type": "string",
      "description": "タスクのタイトル。観察された最大長は41文字（50件中）。余裕を持って80を上限とする。",
      "minLength": 1,
      "maxLength": 80
    },
    "todoMemo": {
      "type": ["string", "null"],
      "description": "任意のメモ。50件中35件がnull。オプション項目。",
      "maxLength": 500
    },
    "isCompleted": {
      "type": "boolean",
      "description": "完了フラグ。一度trueにすると戻す操作は提供しない。"
    },
    "createdAt": {
      "type": "string",
      "format": "date-time",
      "description": "作成日時（ISO 8601）"
    }
  },
  "$comment": "todoMemoのmaxLength 500は観察値（最長約50文字）に余裕を持たせた値。VARCHARのデフォルト255ではなく、実際の用途から導いた。"
}
