[
  {"todoId": "01HQZK3M5P8XVJN2D4F6G7H9RW", "todoTitle": "牛乳を買う", "todoMemo": null, "isCompleted": true, "createdAt": "2026-01-03T08:12:00+09:00"},
  {"todoId": "01HQZK4N6Q9YWKO3E5G7H8ISX", "todoTitle": "歯医者の予約を取る", "todoMemo": "3月中に。去年から先延ばしにしてる", "isCompleted": false, "createdAt": "2026-01-05T21:45:00+09:00"},
  {"todoId": "01HQZK5P7R0ZXLP4F6H8I9JTY", "todoTitle": "確定申告の書類を揃える", "todoMemo": "領収書は引き出しの中", "isCompleted": false, "createdAt": "2026-01-10T09:30:00+09:00"},
  {"todoId": "01HQZK6Q8S1AYMQ5G7I9J0KUZ", "todoTitle": "読書：Clean Architecture", "todoMemo": null, "isCompleted": false, "createdAt": "2026-01-12T22:00:00+09:00"},
  {"todoId": "01HQZK7R9T2BZNR6H8J0K1LV0", "todoTitle": "ジムに行く", "todoMemo": null, "isCompleted": true, "createdAt": "2026-01-14T07:00:00+09:00"},
  {"todoId": "01HQZK8S0U3CAOS7I9K1L2MW1", "todoTitle": "プレゼン資料を修正する", "todoMemo": "フォントサイズとグラフの色", "isCompleted": true, "createdAt": "2026-01-15T14:20:00+09:00"},
  {"todoId": "01HQZK9T1V4DBPT8J0L2M3NX2", "todoTitle": "クレジットカードの明細確認", "todoMemo": null, "isCompleted": true, "createdAt": "2026-01-18T20:00:00+09:00"},
  {"todoId": "01HQZK0U2W5ECQU9K1M3N4OY3", "todoTitle": "新しいルーターを設定する", "todoMemo": "マニュアルはAmazonの注文履歴からPDFをDL", "isCompleted": false, "createdAt": "2026-01-20T11:00:00+09:00"},
  {"todoId": "01HQZL1V3X6FDRV0L2N4O5PZ4", "todoTitle": "友達の誕生日プレゼントを選ぶ", "todoMemo": null, "isCompleted": true, "createdAt": "2026-01-22T19:30:00+09:00"},
  {"todoId": "01HQZL2W4Y7GESW1M3O5P6Q05", "todoTitle": "バックアップを取る", "todoMemo": null, "isCompleted": false, "createdAt": "2026-01-25T10:00:00+09:00"},
  {"todoId": "01HQZL3X5Z8HFTX2N4P6Q7R16", "todoTitle": "Dockerの勉強", "todoMemo": "まずdocker-compose基礎から", "isCompleted": false, "createdAt": "2026-01-28T21:00:00+09:00"},
  {"todoId": "01HQZL4Y6A9IGUY3O5Q7R8S27", "todoTitle": "部屋の掃除", "todoMemo": null, "isCompleted": true, "createdAt": "2026-02-01T09:00:00+09:00"},
  {"todoId": "01HQZL5Z7B0JHVZ4P6R8S9T38", "todoTitle": "光熱費の支払い", "todoMemo": null, "isCompleted": true, "createdAt": "2026-02-02T08:00:00+09:00"},
  {"todoId": "01HQZL6A8C1KIWA5Q7S9T0U49", "todoTitle": "PHPカンファレンス発表資料の骨格を作る", "todoMemo": "テーマ：ドメイン駆動設計とBeフレームワーク", "isCompleted": false, "createdAt": "2026-02-05T16:00:00+09:00"},
  {"todoId": "01HQZL7B9D2LJXB6R8T0U1V50", "todoTitle": "眼鏡を修理に出す", "todoMemo": null, "isCompleted": true, "createdAt": "2026-02-07T12:00:00+09:00"},
  {"todoId": "01HQZL8C0E3MKYC7S9U1V2W61", "todoTitle": "GitHubのREADMEを更新", "todoMemo": "インストール手順が古い", "isCompleted": false, "createdAt": "2026-02-08T10:30:00+09:00"},
  {"todoId": "01HQZL9D1F4NLZD8T0V2W3X72", "todoTitle": "写真の整理", "todoMemo": null, "isCompleted": false, "createdAt": "2026-02-10T20:00:00+09:00"},
  {"todoId": "01HQZL0E2G5OMAE9U1W3X4Y83", "todoTitle": "TypeScriptの型定義を書き直す", "todoMemo": "anyを全部消す", "isCompleted": false, "createdAt": "2026-02-11T14:00:00+09:00"},
  {"todoId": "01HQZM1F3H6PNBF0V2X4Y5Z94", "todoTitle": "プロテインを注文する", "todoMemo": null, "isCompleted": true, "createdAt": "2026-02-13T09:00:00+09:00"},
  {"todoId": "01HQZM2G4I7QOCG1W3Y5Z6A05", "todoTitle": "年次レビューの自己評価を書く", "todoMemo": "締め切り2月末", "isCompleted": true, "createdAt": "2026-02-14T11:00:00+09:00"},
  {"todoId": "01HQZM3H5J8RPDH2X4Z6A7B16", "todoTitle": "本棚を整理する", "todoMemo": null, "isCompleted": false, "createdAt": "2026-02-15T14:00:00+09:00"},
  {"todoId": "01HQZM4I6K9SQEI3Y5A7B8C27", "todoTitle": "テストを書く", "todoMemo": "UserServiceのユニットテストが0%", "isCompleted": false, "createdAt": "2026-02-17T10:00:00+09:00"},
  {"todoId": "01HQZM5J7L0TRFJ4Z6B8C9D38", "todoTitle": "散歩", "todoMemo": null, "isCompleted": true, "createdAt": "2026-02-18T07:30:00+09:00"},
  {"todoId": "01HQZM6K8M1USGK5A7C9D0E49", "todoTitle": "パスポートの更新", "todoMemo": "有効期限：2026年7月。余裕を持って申請", "isCompleted": false, "createdAt": "2026-02-20T09:00:00+09:00"},
  {"todoId": "01HQZM7L9N2VTHL6B8D0E1F50", "todoTitle": "Slackの通知設定を見直す", "todoMemo": null, "isCompleted": true, "createdAt": "2026-02-21T16:00:00+09:00"},
  {"todoId": "01HQZM8M0O3WUIM7C9E1F2G61", "todoTitle": "ブログ記事を書く", "todoMemo": "ALPSとセマンティクスについて", "isCompleted": false, "createdAt": "2026-02-22T21:00:00+09:00"},
  {"todoId": "01HQZM9N1P4XVJN8D0F2G3H72", "todoTitle": "水を飲む", "todoMemo": null, "isCompleted": true, "createdAt": "2026-02-23T13:00:00+09:00"},
  {"todoId": "01HQZM0O2Q5YWKO9E1G3H4I83", "todoTitle": "コードレビューに返信する", "todoMemo": null, "isCompleted": true, "createdAt": "2026-02-24T10:00:00+09:00"},
  {"todoId": "01HQZN1P3R6ZXLP0F2H4I5J94", "todoTitle": "家族に電話する", "todoMemo": null, "isCompleted": true, "createdAt": "2026-02-25T19:00:00+09:00"},
  {"todoId": "01HQZN2Q4S7AYMQ1G3I5J6K05", "todoTitle": "セキュリティアップデートを適用する", "todoMemo": "本番サーバー。メンテナンスウィンドウを確保してから", "isCompleted": false, "createdAt": "2026-02-26T09:00:00+09:00"},
  {"todoId": "01HQZN3R5T8BZNR2H4J6K7L16", "todoTitle": "領収書をスキャンする", "todoMemo": null, "isCompleted": false, "createdAt": "2026-02-27T11:00:00+09:00"},
  {"todoId": "01HQZN4S6U9CAOS3I5K7L8M27", "todoTitle": "新しいコーヒー豆を試す", "todoMemo": "エチオピア イルガチェフェ", "isCompleted": true, "createdAt": "2026-02-28T08:00:00+09:00"},
  {"todoId": "01HQZN5T7V0DBPT4J6L8M9N38", "todoTitle": "会議の議事録をまとめる", "todoMemo": null, "isCompleted": true, "createdAt": "2026-03-01T15:00:00+09:00"},
  {"todoId": "01HQZN6U8W1ECQU5K7M9N0O49", "todoTitle": "ランニングシューズを買い替える", "todoMemo": null, "isCompleted": false, "createdAt": "2026-03-02T10:00:00+09:00"},
  {"todoId": "01HQZN7V9X2FDRV6L8N0O1P50", "todoTitle": "DBのインデックスを見直す", "todoMemo": "スロークエリログに何度も出てきてる", "isCompleted": false, "createdAt": "2026-03-03T14:00:00+09:00"},
  {"todoId": "01HQZN8W0Y3GESW7M9O1P2Q61", "todoTitle": "植物に水をやる", "todoMemo": null, "isCompleted": true, "createdAt": "2026-03-04T08:00:00+09:00"},
  {"todoId": "01HQZN9X1Z4HFTX8N0P2Q3R72", "todoTitle": "依存パッケージを更新する", "todoMemo": null, "isCompleted": false, "createdAt": "2026-03-05T10:00:00+09:00"},
  {"todoId": "01HQZN0Y2A5IGUY9O1Q3R4S83", "todoTitle": "映画を観る", "todoMemo": "ウォッチリストに30本溜まってる", "isCompleted": false, "createdAt": "2026-03-06T20:00:00+09:00"},
  {"todoId": "01HQZO1Z3B6JHVZ0P2R4S5T94", "todoTitle": "ドキュメントを書く", "todoMemo": null, "isCompleted": false, "createdAt": "2026-03-07T11:00:00+09:00"},
  {"todoId": "01HQZO2A4C7KIWA1Q3S5T6U05", "todoTitle": "エラーログを確認する", "todoMemo": null, "isCompleted": true, "createdAt": "2026-03-08T09:00:00+09:00"},
  {"todoId": "01HQZO3B5D8LJXB2R4T6U7V16", "todoTitle": "夕食のメニューを考える", "todoMemo": null, "isCompleted": true, "createdAt": "2026-03-09T17:00:00+09:00"},
  {"todoId": "01HQZO4C6E9MKYC3S5U7V8W27", "todoTitle": "フィードバックをまとめてチームに共有する", "todoMemo": "先週のユーザーインタビュー5件分", "isCompleted": false, "createdAt": "2026-03-10T10:00:00+09:00"},
  {"todoId": "01HQZO5D7F0NLZD4T6V8W9X38", "todoTitle": "ストレッチ", "todoMemo": null, "isCompleted": false, "createdAt": "2026-03-10T07:00:00+09:00"},
  {"todoId": "01HQZO6E8G1OMAE5U7W9X0Y49", "todoTitle": "キーボードを掃除する", "todoMemo": null, "isCompleted": false, "createdAt": "2026-03-11T13:00:00+09:00"},
  {"todoId": "01HQZO7F9H2PNBF6V8X0Y1Z50", "todoTitle": "週次レビュー", "todoMemo": "今週できたこと・できなかったこと・来週の目標", "isCompleted": false, "createdAt": "2026-03-11T18:00:00+09:00"},
  {"todoId": "01HQZO8G0I3QOCG7W9Y1Z2A61", "todoTitle": "デプロイ手順書を更新する", "todoMemo": null, "isCompleted": false, "createdAt": "2026-03-12T10:00:00+09:00"},
  {"todoId": "01HQZO9H1J4RPDH8X0Z2A3B72", "todoTitle": "新しい開発環境をセットアップ", "todoMemo": "M4 MacBook Pro届いた", "isCompleted": false, "createdAt": "2026-03-12T14:00:00+09:00"},
  {"todoId": "01HQZO0I2K5SQEI9Y1A3B4C83", "todoTitle": "来月の旅行の宿を予約する", "todoMemo": null, "isCompleted": false, "createdAt": "2026-03-12T16:00:00+09:00"},
  {"todoId": "01HQZP1J3L6TRFJ0Z2B4C5D94", "todoTitle": "チームの1on1をスケジュールする", "todoMemo": null, "isCompleted": false, "createdAt": "2026-03-12T17:00:00+09:00"},
  {"todoId": "01HQZP2K4M7USGK1A3C5D6E05", "todoTitle": "本を返却する", "todoMemo": "図書館。返却期限今週土曜", "isCompleted": false, "createdAt": "2026-03-12T20:00:00+09:00"}
]
